[
  {"id":"PAIN-0601","title":"Preclinical lab notebook → regulatory submission","vertical":"Preclinical R&D","workflow_family":"extraction_validation","persona":"Bench scientist / lab manager","pain_description":"Lab notebooks still paper or PDF; data transcribed into GLP reports; reproducibility drops; FDA filings delayed.","pain_severity":9,"tedium_score":10,"tam_direction":"growing","current_wtp_usd_month":800,"incumbent_tools":["Benchling","LabArchives","SciNote"],"incumbent_gap":"ELN yes; auto-extraction + regulatory drafting thin","santifer_pattern":"ELN ingest + LLM extractor + GLP template generator","opportunity_score":80,"tags":["pharma","rd","regulated"]},
  {"id":"PAIN-0602","title":"CRO (contract research org) site coordination","vertical":"CRO Ops","workflow_family":"triage_routing","persona":"CRO clinical ops lead","pain_description":"100+ trial sites × dozens of sponsors; site-specific issues + IRB correspondence + deviations — email chains.","pain_severity":10,"tedium_score":10,"tam_direction":"growing","current_wtp_usd_month":3000,"incumbent_tools":["Veeva CTMS","Medidata","Oracle Health Sciences"],"incumbent_gap":"Enterprise CTMS; agent layer thin","santifer_pattern":"Site issue intake + classifier + sponsor comms","opportunity_score":82,"tags":["pharma","clinical"]},
  {"id":"PAIN-0603","title":"Academic journal peer-review coordination","vertical":"Scholarly Publishing","workflow_family":"outbound_followup","persona":"Journal editor","pain_description":"Assigning reviewers + chasing reviews + handling revisions = months per paper; editors burn out.","pain_severity":8,"tedium_score":10,"tam_direction":"stable","current_wtp_usd_month":600,"incumbent_tools":["Editorial Manager","ScholarOne","Manuscript Central"],"incumbent_gap":"Legacy UX; agent outreach thin","santifer_pattern":"Reviewer DB + LLM match + chase + revision tracker","opportunity_score":74,"tags":["academic","publishing"]},
  {"id":"PAIN-0604","title":"Grant application drafting + budget","vertical":"Research Grants","workflow_family":"synthesis_reporting","persona":"PI applying NIH R01","pain_description":"R01 takes 6-9 months; specific-aims iteration; biosketch + budget + facilities — paper heavy.","pain_severity":10,"tedium_score":10,"tam_direction":"stable","current_wtp_usd_month":200,"incumbent_tools":["Cayuse","Grantable","Notion"],"incumbent_gap":"Word templates; LLM drafting emerging","santifer_pattern":"Aims + literature RAG + LLM drafter + budget builder","opportunity_score":78,"tags":["academic","grants"]},
  {"id":"PAIN-0605","title":"Bench chemistry synthesis planning + retrosynthesis","vertical":"Medicinal Chemistry","workflow_family":"synthesis_reporting","persona":"Med chem scientist","pain_description":"Synthesis route planning + yield prediction + commercially available building blocks — hours per molecule.","pain_severity":8,"tedium_score":9,"tam_direction":"growing","current_wtp_usd_month":1000,"incumbent_tools":["Reaxys","SciFinder","Chemaxon"],"incumbent_gap":"Database; LLM reasoning emerging","santifer_pattern":"Target structure + LLM retrosynthesis + reagent sourcing","opportunity_score":75,"tags":["pharma","chemistry"]},
  {"id":"PAIN-0606","title":"Bioanalytical lab: LC-MS data validation","vertical":"Bioanalysis","workflow_family":"extraction_validation","persona":"Bioanalytical lab scientist","pain_description":"LC-MS assays for PK studies; peak integration + outlier detection manual; each run audited.","pain_severity":9,"tedium_score":10,"tam_direction":"stable","current_wtp_usd_month":1500,"incumbent_tools":["Analyst (Sciex)","MassHunter","Watson LIMS"],"incumbent_gap":"Instrument software; QC agents thin","santifer_pattern":"Peak data + LLM QC + audit trail","opportunity_score":76,"tags":["pharma","lab"]},
  {"id":"PAIN-0607","title":"Clinical data manager: EDC query resolution","vertical":"Clinical Data Mgmt","workflow_family":"triage_routing","persona":"CDM at sponsor / CRO","pain_description":"EDC throws queries on inconsistent data; resolution via site queries; database lock delayed weeks.","pain_severity":9,"tedium_score":10,"tam_direction":"growing","current_wtp_usd_month":2000,"incumbent_tools":["Medidata Rave","Oracle Inform","Veeva EDC"],"incumbent_gap":"Enterprise EDC","santifer_pattern":"Query + context + LLM resolver + site comms","opportunity_score":80,"tags":["pharma","clinical"]},
  {"id":"PAIN-0608","title":"Biostatistician SAP + TLF programming","vertical":"Biostatistics","workflow_family":"synthesis_reporting","persona":"Biostat programmer","pain_description":"Statistical Analysis Plan + tables/listings/figures in SAS; iterative regulatory asks; bottleneck.","pain_severity":9,"tedium_score":10,"tam_direction":"stable","current_wtp_usd_month":2500,"incumbent_tools":["SAS","R","Medidata Detect"],"incumbent_gap":"Code-heavy","santifer_pattern":"SAP + data + LLM SAS generator + TLF drafter","opportunity_score":77,"tags":["pharma","stats"]},
  {"id":"PAIN-0609","title":"Regulatory intelligence: monitoring agency guidance","vertical":"Regulatory Affairs","workflow_family":"synthesis_reporting","persona":"Regulatory affairs lead","pain_description":"FDA / EMA / PMDA issue guidance docs, warning letters, precedents — team reads manually; missing updates = submission rejects.","pain_severity":9,"tedium_score":10,"tam_direction":"stable","current_wtp_usd_month":1500,"incumbent_tools":["RAPS","FDAnews","Tarius"],"incumbent_gap":"Newsletters; not personalized","santifer_pattern":"Guidance feed + LLM relevance + brief per product","opportunity_score":79,"tags":["pharma","regulatory"]},
  {"id":"PAIN-0610","title":"Patent landscape + freedom-to-operate","vertical":"Pharma IP","workflow_family":"synthesis_reporting","persona":"Pharma patent attorney","pain_description":"FTO analysis before compound submission; searching patent DBs + literature; days per molecule.","pain_severity":9,"tedium_score":10,"tam_direction":"stable","current_wtp_usd_month":2000,"incumbent_tools":["Derwent","PatSnap","Questel"],"incumbent_gap":"Search; not synthesis","santifer_pattern":"Structure + claims parse + LLM FTO memo","opportunity_score":78,"tags":["pharma","ip"]},
  {"id":"PAIN-0611","title":"CMC / manufacturing changes for marketed drugs","vertical":"CMC","workflow_family":"compliance_audit","persona":"CMC lead","pain_description":"Manufacturing changes trigger supplement filings; categorization (CBE-0 / CBE-30 / PAS) complex; misfile = enforcement.","pain_severity":10,"tedium_score":10,"tam_direction":"stable","current_wtp_usd_month":3000,"incumbent_tools":["Veeva Vault RIM","Ennov"],"incumbent_gap":"Doc mgmt","santifer_pattern":"Change intake + regulatory rule + filing drafter","opportunity_score":80,"tags":["pharma","cmc"]},
  {"id":"PAIN-0612","title":"Pharmaceutical quality investigations (OOS/OOT)","vertical":"Pharma Quality","workflow_family":"compliance_audit","persona":"QA investigator","pain_description":"Out-of-spec results trigger Phase I/II investigations; root cause + CAPA in 30 days; misses bring Form 483.","pain_severity":10,"tedium_score":10,"tam_direction":"stable","current_wtp_usd_month":2000,"incumbent_tools":["TrackWise","Veeva QualityDocs"],"incumbent_gap":"QMS","santifer_pattern":"OOS intake + LLM investigation agent + CAPA","opportunity_score":79,"tags":["pharma","quality"]},
  {"id":"PAIN-0613","title":"SaaS ML + data science experiments tracking","vertical":"ML Research","workflow_family":"synthesis_reporting","persona":"ML researcher / DS","pain_description":"Dozens of runs/week; hyperparams + metrics + notebooks scattered; reproducibility nightmare.","pain_severity":8,"tedium_score":9,"tam_direction":"growing","current_wtp_usd_month":200,"incumbent_tools":["Weights & Biases","MLflow","Neptune.ai"],"incumbent_gap":"Tracking; synthesis agents thin","santifer_pattern":"Run log + LLM report + experiment recommender","opportunity_score":72,"tags":["ml","research"]},
  {"id":"PAIN-0614","title":"Chemistry manufacturing (CMO) tech transfer","vertical":"CMO","workflow_family":"extraction_validation","persona":"Tech transfer engineer","pain_description":"Transferring process from R&D to CMO site: batch records + SOP + validation — dozens of docs per campaign.","pain_severity":9,"tedium_score":10,"tam_direction":"stable","current_wtp_usd_month":2500,"incumbent_tools":["MasterControl","Aspentech"],"incumbent_gap":"QMS","santifer_pattern":"Dev data + CMO receiver + LLM batch-record generator","opportunity_score":76,"tags":["pharma","cmo"]},
  {"id":"PAIN-0615","title":"Genomic variant classification + interpretation","vertical":"Genomics","workflow_family":"extraction_validation","persona":"Clinical variant scientist","pain_description":"Each variant needs classification (ACMG); literature search + family history + functional data — hours per variant.","pain_severity":9,"tedium_score":10,"tam_direction":"rapidly-growing","current_wtp_usd_month":2500,"incumbent_tools":["Alamut","VarSome","Franklin"],"incumbent_gap":"Knowledge bases; LLM synthesis emerging","santifer_pattern":"Variant + literature RAG + ACMG rules + draft classification","opportunity_score":81,"tags":["genomics","healthcare"]},
  {"id":"PAIN-0616","title":"Bench scientist literature keep-up","vertical":"R&D","workflow_family":"synthesis_reporting","persona":"Industrial R&D scientist","pain_description":"Publications outpace reading; competitive signals missed; 'stay current' is a second job.","pain_severity":8,"tedium_score":9,"tam_direction":"growing","current_wtp_usd_month":100,"incumbent_tools":["Scholarcy","Elicit","ResearchRabbit"],"incumbent_gap":"Emerging","santifer_pattern":"Topic feed + LLM digest + competitive alert","opportunity_score":73,"tags":["research","rd"]},